{
  "schema_version": 1,
  "id": "env-local-1",
  "kind": "local",
  "name": "Default Local Environment",
  "address": "127.0.0.1",
  "access_method": "direct",
  "working_root": "/Users/datnguyen/Projects/arsenal",
  "proxy_url": null,
  "ca_path": null,
  "browser_trust_path": null,
  "tool_index_path": null,
  "path_overrides": null,
  "observed_at": "2026-10-08T07:10:30.658Z"
}